{
  "$schema": "../../../schemas/genre.schema.json",
  "id": "hack_slash",
  "label": "ハックアンドスラッシュ",
  "thresholds": { "enemy": 5, "combo": 4 },
  "resolvable": false,
  "enableFeatures": ["shoot", "enemy_hp", "exp", "item_pickup", "dash", "boss"],
  "disableFeatures": ["grid_stop", "puzzle_solve", "stealth_mode", "slow_precise"],
  "scoreFormula": "kills * 90 + maxCombo * 200 + exp * 2 + bossKills * 400",
  "manualReveal": "これはハックアンドスラッシュになりました。コンボを繋いでください。",
  "theme": "stg",
  "bgColor": "#150000",
  "controls": {
    "jump": "Space",
    "moveLeft": "ArrowLeft",
    "moveRight": "ArrowRight",
    "moveUp": "ArrowUp",
    "moveDown": "ArrowDown",
    "shoot": "z",
    "dash": "Shift"
  },
  "gravity": 1600,
  "endingFlavor": "あなたはコンボを途切れさせなかった。説明書は斬られて散った。"
}
