{
  "$schema": "../../../schemas/genre.schema.json",
  "id": "arena",
  "label": "アリーナバトル",
  "thresholds": { "enemy": 7, "combo": 5 },
  "resolvable": false,
  "enableFeatures": ["shoot", "enemy_hp", "boss", "dash"],
  "disableFeatures": ["auto_run", "grid_stop", "puzzle_solve", "stealth_mode"],
  "scoreFormula": "kills * 110 + bossKills * 500 + maxCombo * 130",
  "manualReveal": "これはアリーナバトルになりました。全てを倒してください。",
  "theme": "stg",
  "bgColor": "#0f0000",
  "controls": {
    "jump": "Space",
    "moveLeft": "ArrowLeft",
    "moveRight": "ArrowRight",
    "moveUp": "ArrowUp",
    "moveDown": "ArrowDown",
    "shoot": "z",
    "dash": "Shift"
  },
  "gravity": 1600,
  "endingFlavor": "あなたは闘技場の覇者になった。説明書は戦利品として飾られた。",
  "spawnDensity": {
    "baseInterval": 1500,
    "minInterval": 500,
    "decayRate": 0.00025
  }
}
