{
  "$schema": "../../../schemas/genre.schema.json",
  "id": "tetris",
  "label": "テトリス",
  "thresholds": { "combo": 5, "craft": 5 },
  "enableFeatures": ["tetris_mode"],
  "disableFeatures": ["auto_run", "shoot", "beat_hazard", "boss", "stealth_mode", "slow_precise"],
  "scoreFormula": "combo * 300 + survivedSec * 10",
  "manualReveal": "これはテトリスになりました。ブロックを積み上げてください。",
  "theme": "tetris",
  "bgColor": "#0a0a0a",
  "scrollDirection": "none",
  "controls": {
    "jump": "Space",
    "moveLeft": "ArrowLeft",
    "moveRight": "ArrowRight",
    "moveUp": "ArrowUp",
    "moveDown": "ArrowDown"
  },
  "gravity": 0,
  "endingFlavor": "あなたはブロックを積み重ねた。説明書もその塔の一部になった。",
  "bgm": { "src": "bgm/tetris.ogg", "loop": true, "volume": 0.5, "fadeInMs": 1000 }
}
